Post id,Date,post_text,Link,Impressions,Likes,Engagements,Bookmarks,Share,New follows,Replies,Reposts,Profile visits,Detail expands,Url clicks,Hashtag clicks,Permalink clicks
,,***PSA FROM RANKING MEMBER @RepRaskin: A SERIAL CONSTITUTIONAL VIOLATOR IS AT LARGE IN THE DISTRICT OF COLUMBIA*** https://t.co/x5MZ9o6CJZ,,,,,,,,,,,,,,
,,Watch House Republican thank corrupt billionaire Musk for doing a job he has no lawful power to do and the Republican was elected to do but is not doing! https://t.co/FsZDD558Jv,,,,,,,,,,,,,,
,,Trump thinks the First Amendment only protects speech he agrees with. @RepDeborahRoss explains: that's not how it works. https://t.co/erTPp95wTA,,,,,,,,,,,,,,
,,".@RepRaskin reminds Americans that censorship ALREADY occurred under Trump’s previous administration. And yes, Rep. Raskin reminded Republicans of that time Trump tried to remove Chrissy Teigen’s infamous Tweet. https://t.co/wGrZnctYhl",,,,,,,,,,,,,,
,,".@RepTedLieu: Trump campaigned on lowering prices. He lied to you. Congressional Republicans have also done nothing to lower prices. This hearing is a prime example. This Republican controlled Judiciary Committee could hold a hearing on price gouging, on antitrust, and how https://t.co/KF6ZhQoYb2",,,,,,,,,,,,,,
,,.@RepJerryNadler exposes Trump’s FCC chief for weaponizing the government against the free press. https://t.co/a8CDT6j67p,,,,,,,,,,,,,,
,,.@RepRaskin points out that even their own witness warned that Musk is stifling free speech on X and Trump would continue to attack the free press—now the right-wing techno-censorship state is in high gear. https://t.co/t2Tk7ABGKj,,,,,,,,,,,,,,
,,Ranking Member @RepRaskin delivers opening remarks during today’s hearing on right-wing techno-censorship. https://t.co/EP8L6Ea4uu,,,,,,,,,,,,,,
,,NEW: Ranking Member @RepRaskin responds to Trump’s latest executive order to end enforcement of the Foreign Corrupt Practices Act (FCPA). https://t.co/kKO8wyiQkc,,,,,,,,,,,,,,
,,.@RepLouCorrea calls out the true cost of gutting regulations: jeopardizing public health and safety. https://t.co/E7MQCldSaa,,,,,,,,,,,,,,
,,"Ranking Member @RepRaskin, in his opening statement, highlights how Republicans are undermining the rule of law and weakening our government: https://t.co/T0tblWHfwJ",,,,,,,,,,,,,,
,,Ranking Member @RepJerryNadler delivers opening remarks during today’s hearing on regulatory and administrative law. https://t.co/4PnjD2Y0Di,,,,,,,,,,,,,,
,,.@RepRaskin on the Constitutional crisis caused by Trump and Musk: “We are going to mobilize a mass movement in the country to force them to back off of these attacks on the Constitution and the rule of law.” https://t.co/aIoNe7ekub,,,,,,,,,,,,,,
,,Then Musk sent the same “fork in the road” letter to drive out federal civil servants that he sent to drive out Twitter employees.,,,,,,,,,,,,,,
,,"Donald Trump sold control over our government to billionaire defense contractor Elon Musk for just under $300 million, less than what Musk paid for Twitter… https://t.co/I09ouHGC5t",,,,,,,,,,,,,,
,,"Elon Musk, you may have illegally seized power over the financial payment systems of the United States Department of Treasury, but you don’t control the budget and spending of the American people. The United States Congress does that—under Article I of the Constitution.",,,,,,,,,,,,,,
,,"Justice isn’t a partisan game—@RepRaskin warns against politicizing law enforcement: “You can't fire neutral, nonpolitical officers like prosecutors, like FBI agents, like cops, simply because a new party comes to power and they think that they want to stuff it with their own https://t.co/Re2yUEi5NK",,,,,,,,,,,,,,
,,"BREAKING: In trio of letters, Ranking Member Raskin demands an end to the Trump Administration’s lawless political purges of career officials at the DOJ and FBI.",,,,,,,,,,,,,,
,,.@RepBeccaB: “All this talk of DEI is a complete and utter distraction from the fact that we need an actual plan to help the people of California who have lost everything.” https://t.co/CtsOb2vCq1,,,,,,,,,,,,,,
,,"Stop with the misinformation. There is no so-called “valve.” But the water Donald Trump directed the Army Corps of Engineers to release from two dams has NO physical connection to the water firefighters need to fight fires in LA. Literally, you cannot move that water from https://t.co/R0fSn55jX2",,,,,,,,,,,,,,
,,"Thanks to Donald Trump’s incompetence, billions of gallons of water were sent into a dry lake bed in California’s Central Valley, where scientists say it can’t flow south to where the fires are located. Much of this water will likely stagnate or flow uselessly into the Pacific https://t.co/FexJPWqgo8",,,,,,,,,,,,,,
,,.@RepTedLieu shames Republicans for politicizing the recovery efforts for the devastating California wildfires. https://t.co/mYrjsjwpA7,,,,,,,,,,,,,,
,,Ranking Member @RepJerryNadler delivers remarks during today’s hearing on the California fires. https://t.co/qvf9YNmHpf,,,,,,,,,,,,,,
,,".@RepRaskin: “Elon Musk, you didn't create USAID. The United States Congress did for the American people … like Elon Musk did not create USAID; he doesn't have the power to destroy it. And who's going to stop him? We are.”",,,,,,,,,,,,,,
,,Democrats blast Musk and Trump over dismantling USAID https://t.co/za4sX2mIfs,,,,,,,,,,,,,,
,,"Unexpectedly, @RepRaskin finds common ground with Steve Bannon and Laura Loomer when it comes to Elon Musk: “I’m with Steve Bannon, Laura Loomer and the people on the right who are saying, watch Elon Musk because he because he's the guy who's trying to centralize all power behind",,,,,,,,,,,,,,
,,.@RepRaskin warns America about the illegal ‘fourth branch’ of government called Elon Musk: “A coup is a seizure of state power by unelected actors who work to take over the critical infrastructure of government outside of the rule of law. That's what I see as going on right now. https://t.co/okiv0QNT25,,,,,,,,,,,,,,
,,"So much for ‘law and order’! The party of Trump stands for pardoning cop beaters and drug traffickers while firing prosecutors and law enforcement officers. This Administration’s chaotic actions undermine efforts to combat violent crime, threaten our national security, and",,,,,,,,,,,,,,
,,"Why is the Trump administration obsessed with arresting nonviolent immigrants instead of violent criminals, drug traffickers, and terrorists? This dangerous diversion of our federal, state, and local law enforcement officers makes us less safe, just like pardoning cop-assaulting",,,,,,,,,,,,,,
,,"🚨 Trump’s DOJ is going soft on crime and making America less safe. Federal law enforcement is being pulled away from counterterrorism, violent crime-fighting and combatting drug trafficking in order to conduct mass arrests of undocumented immigrants who pose no threat to public",,,,,,,,,,,,,,
,,Ranking Members @RepRaskin and @RepJayapal demand answers from DHS and ICE following reports that ICE wrongfully detained U.S. citizens during immigration enforcement raids.,,,,,,,,,,,,,,
,,"Karoline Leavitt, Trump’s Press Secretary, said, ""all of you once again have access to the most transparent and accessible president in American history."" Got it. Then will you publicly release Volume Two of Special Counsel Jack Smith’s report in its entirety, without redactions? https://t.co/S0YW4jSkQy",,,,,,,,,,,,,,
,,He probably got the idea for this monarchical slush fund from the Royal Crown Prince of Saudi Arabia who stuffed Jared Kushner’s pockets with billions. No thx.,,,,,,,,,,,,,,
,,"As part of Trump’s moronic effort to turn us into an oil monarchy, he proposes a “sovereign wealth fund” he could run without congressional oversight… https://t.co/0lZMsOASt5",,,,,,,,,,,,,,
,,"Billionaire government contractor Elon Musk ponied up $290 MILLION to get Trump elected. Now he’s collecting on the debt by seizing control over the government’s multi-trillion-dollar payment system and Americans’ private financial data. Conflict of interest, anyone?",,,,,,,,,,,,,,
,,"Trump says his tariffs address the fentanyl crisis. OK. But then why impose a 25% tariff on Canada but only 10% on China, the source of illegal fentanyl? Why did he pardon a drug dealer and criminal profiteer whose underground website was used to distribute opioids and other",,,,,,,,,,,,,,
,,"Billionaire Trump promised to LOWER prices for America, but now warns the common people to expect ""a little pain"" after his bizarre tariffs on Canada and Taiwan are imposed. He said he was going after China but apparently Elon Musk won’t let him do that because all the autocrats",,,,,,,,,,,,,,
,,"NEW: House Judiciary Democrats demand DOJ release Special Counsel Jack Smith’s full report on Trump’s mishandling of classified documents, after the Department moved to dismiss charges against Trump’s co-conspirators: https://t.co/Hcl7J8wcFY",,,,,,,,,,,,,,
,,"To any federal employees considering Elon Musk’s “Fork in the Road” resignation request, here is what a legitimate buyout offer is supposed to look like: *Sets out the legal authority for the buyout *Explains exactly how much money employees are being offered *Encourages https://t.co/MkDmpUMBKc",,,,,,,,,,,,,,
,,"Rob Shriver, fmr director of the U.S. Office of Personnel Management, now at @DemocracyFWD, on the career civil servants targeted by the Trump Administration: “Folks need to understand that we are fighting for them, that there are people out here that care deeply.” https://t.co/Wg6TcgMHdh",,,,,,,,,,,,,,
,,"@DemocracyFwd This power grab overthrows the people who protect national security, ensure food and drug safety, and provide essential public services.",,,,,,,,,,,,,,
,,"Rob Shriver, fmr director of the U.S. Office of Personnel Management, now at @DemocracyFWD, condemns the Trump Administration's plan to replace expert civil servants with robotic political loyalists. https://t.co/FOxi9nawU9",,,,,,,,,,,,,,
,,"Erica Newland, from @protctdemocracy, explains how executive branch purges, under the cover of civil service reform, are textbook authoritarian tactics—designed to strip power, wealth, and dignity from the people and concentrate it in the hands of the leader and his loyalists. https://t.co/kTW5gMSITp",,,,,,,,,,,,,,
,,"Dana Gold of @GovAcctProj, warns that relentless attacks on civil servants—especially at DOJ—undermine productivity, trust and the public mission. Fear of retaliation and the futility of reporting misconduct erode the accountability that democracy requires. https://t.co/Snb1pywqWH",,,,,,,,,,,,,,
,,".@JimEisenmann, fmr Executive Director of the U.S. Merit Systems Protection Board, calls the civil service the backbone of government—where skill and accountability replace political patronage. It’s taken centuries to build government free from purges and partisan power plays. https://t.co/Xpupc7dQKD",,,,,,,,,,,,,,
,,"Stacey Young of Justice Connection details the Trump Administration's campaign to frighten and undermine DOJ employees and impede their ability to perform their duties. In just two weeks, career DOJ staff have been fired, demoted, and reassigned in a sweeping purge. https://t.co/4pYandy3RS",,,,,,,,,,,,,,
,,"Ranking Member @RepRaskin warns that Trump and his billionaire allies are waging an all-out assault on federal workers. Their push to dismantle merit-based civil service threatens national security, public safety, and the fair enforcement of the law, putting America at risk. https://t.co/XRtogLIJN2",,,,,,,,,,,,,,
,,Ranking Member Raskin’s statement on Donald Trump’s baseless scapegoating after tragic plane crash. https://t.co/yawOxrs1Db,,,,,,,,,,,,,,
,,BREAKING: RM @RepRaskin issues a statement in response to Donald Trump's lawless and dangerous purge of FBI agents and DOJ prosecutors. https://t.co/pQ4KIH1KyE,,,,,,,,,,,,,,
,,How exactly does locking up migrants in an offshore prison—one with a history of torture—make America great again?,,,,,,,,,,,,,,
,,"NEW from RM @RepRaskin on Kash Patel: ""This political operative’s wavering commitment to the rule of law and spectacular disrespect for the truth disqualify him as a candidate to lead the nation’s premier law enforcement organization."" https://t.co/KRDCKQGjrB",,,,,,,,,,,,,,
,,"Kash Patel, a guy who sold MAGA merch with QAnon symbols and spent years attacking the FBI is now Trump’s choice to run the FBI. This isn’t about law and order but chaos and revenge. https://t.co/5paNKYaD6g",,,,,,,,,,,,,,
,,"Kash Patel’s lies about January 6th should be disqualifying. He pushes deranged conspiracy theories to cover up the truth: Trump, his enablers and followers set about to “stop the steal” and “fight like hell” to overturn the election. https://t.co/jLcTqwbAwZ",,,,,,,,,,,,,,
,,"Kash Patel’s book promotes his “enemies list”—the people he wants to persecute, prosecute, and harass. If he’s Director, the FBI will be an instrument of political revenge and social chaos. https://t.co/O2oH98Vapi",,,,,,,,,,,,,,
,,"Alarm bells ringing: Founder of the Oath Keepers, convicted of seditious conspiracy, backs Kash Patel for the FBI: “The Deep State is still there, we have to root ‘em out, I’m still of the opinion, and I think Kash Patel’s down with that…” https://t.co/PPK0g8d97T",,,,,,,,,,,,,,
,,"On Steve Bannon’s show in 2023, Kash Patel openly bragged about Trump's retribution agenda, threatening reporters who refuse to echo the Big Lie that Trump won in 2020 (an election he lost by more than 7 million votes): “We're going to come after the people in the media who lied https://t.co/SM2pbZsEMw",,,,,,,,,,,,,,
,,The FBI’s mission is to protect the American people and uphold the Constitution against criminal attack. It does not exist to settle the president’s scores or to persecute citizens on his “enemies list.” https://t.co/jvquBkUDaQ,,,,,,,,,,,,,,
,,The Hill: House Democratic leaders are asking Justice Department officials to explain an “onslaught” of firings and reassignments of prosecutors during President Trump’s first week in office. https://t.co/xdTECk0QfB,,,,,,,,,,,,,,
,,"NEWS: Ranking Member @RepRaskin, @RepJayapal, @SenatorDurbin, and @SenAlexPadilla call on @SecRubio to immediately restore vital services for refugees already in the United States. https://t.co/TgPS84pZIn",,,,,,,,,,,,,,
,,"Mr. US Attorney—you’re not the President’s lawyer. You took an oath to the Constitution, not the President. You are purely a “servant of the law.” Your duty is neither to visit retribution on Trump’s critics nor to bestow favor on his violent foot soldiers and billionaire https://t.co/LZsOXBtm1A",,,,,,,,,,,,,,
,,Trump is attempting to erase the truth of January 6 by scrubbing an online database documenting the extensive criminal charges and convictions from the riots. We won’t let him erase and rewrite history. https://t.co/E0xkx7nGPB,,,,,,,,,,,,,,
,,NEW: RM @RepRaskin released a statement and a fact sheet after the Trump Administration announced a sweeping freeze on all federal funding—a brazen attack on millions of American families and a blatant episode of executive trespass on Congressional powers. https://t.co/nphQq2STZg,,,,,,,,,,,,,,
,,"The new Defense Secretary’s only management experience was running a small nonprofit into the ground. The many allegations of sexual assault, financial mismanagement, and alcohol abuse make him a textbook target for blackmail and manipulation. His main goal? To “fire a ton of",,,,,,,,,,,,,,
,,"Egg prices are soaring thanks to widespread bird flu outbreaks, and what’s Trump focused on? Scrambling to fix the economy? ❌ Protecting public health? ❌ Cooking up revenge and retribution schemes against fellow citizens? ✅ https://t.co/XGe14nwdyW",,,,,,,,,,,,,,
,,"NEWS: Ranking Members @RepRaskin and @GerryConnolly demand answers regarding widespread firings, involuntary reassignments of career employees at DOJ https://t.co/4XfQVYamb7 https://t.co/Y9oI2XMXCA",,,,,,,,,,,,,,
,,NEWS: House Democratic Ranking Members condemn Donald Trump’s illegal and brazen attempt to purge the independent watchdogs who protect Americans’ tax dollars and uphold government accountability. The Ranking Members wrote: “We write to express our grave concern about your,,,,,,,,,,,,,,
,,"NEWS: Under the Biden administration, the FTC sued PepsiCo for rigging soft drink competition. The second largest food company in the WORLD has allegedly given Walmart, the largest retailer on earth, exclusive price breaks. This kind of price discrimination creates food",,,,,,,,,,,,,,
,,"Imagine you’re working for Donald Trump, and you see him strip your predecessor of his security detail for respecting the law. Would you dare challenge him, offer an independent viewpoint, or push back against his decisions? Likely not because the message is chillingly clear:",,,,,,,,,,,,,,
,,".@RepLauraGillen: Americans want us to lower costs, secure our border, and create jobs – NOT interfere with heartbreaking family medical decisions. Our daughters deserve better. https://t.co/gd6e2twcZz",,,,,,,,,,,,,,
,,.@RepLSimon knows what’s at stake when abortion rights come under attack. Politicians should stay out of the exam room. https://t.co/UOJB3IcQYQ,,,,,,,,,,,,,,
,,.@RepBynum: It's nonsense that my daughters have less rights than I did at their age. It's nonsense that we have had to decide with them where to live and where to go to school based on where they have rights. And it's nonsense that my daughters are less safe because of https://t.co/cjoSfLSzW5,,,,,,,,,,,,,,
,,.@RepDexterOR: No doctor should have to choose between administering the treatment their patient needs and going to jail. And no politician should be making decisions about any patient's health care. https://t.co/NSxxpdbqiR,,,,,,,,,,,,,,
,,"Donald Trump pardoned hundreds of violent, cop-beating insurrectionists not because they were innocent or contrite but because they are guilty and unrepentant. By pardoning the rampaging mob he incited, Trump follows other authoritarians in creating a reserve army of political https://t.co/E0xkx7nGPB",,,,,,,,,,,,,,
,,ICYMI: @RepRaskin issued the following statement in response to a new Trump DOJ directive to investigate and prosecute state and local government officials over immigration enforcement—a blatant threat to constitutionally protected state sovereignty: https://t.co/cSNfJnqfDV,,,,,,,,,,,,,,
,,".@RepPressley to GOP: Let me be clear what you're doing here. You're not only putting women's lives at risk, but you want to deny them the chance to hold their baby. https://t.co/iX3q6q7y2s",,,,,,,,,,,,,,
,,".@RepRaskin: Who do you want in the doctor's office with you making a medical decision, doctors or MAGA politicians? https://t.co/ShmPC20qEz",,,,,,,,,,,,,,
,,".@RepLucyMcBath shares her personal story, exposing how restrictive efforts on abortion care—like the MAGA GOP’s bill being voted on today—put women's lives at risk and criminalize doctors for providing necessary, life-saving care. https://t.co/z2gVAwez5h",,,,,,,,,,,,,,
,,WATCH as @WhipKClark explains the GOP’s efforts to enact a nationwide abortion ban. https://t.co/QZF8Vov9QB,,,,,,,,,,,,,,
,,".@RepTimKennedy shares a powerful personal story, highlighting how the GOP’s extreme anti-abortion legislation being debated today poses a grave threat to women’s health and safety. https://t.co/DYWEhQ7Ru1",,,,,,,,,,,,,,
,,"Rep. @KellyMorrisonMN, an OBGYN with 20 years of experience, shares her firsthand knowledge to warn how the GOP’s so called ""born alive"" bill would endanger women’s health and criminalize doctors. https://t.co/JDUuKdA1aN",,,,,,,,,,,,,,
,,And the Special Counsel Jack Smith report: https://t.co/eKMeHBpPe3,,,,,,,,,,,,,,
,,And for those who want to read the wholly unrefuted bipartisan report based on two years of research: https://t.co/wFEKulvb89,,,,,,,,,,,,,,
,,"A primer for those ""investigating"" January 6 for the first time: 1. Trump knew he lost in 2020 by more than 7 million votes, 306-232 in the electoral college, but spread the Big Lie even after losing more than 60 federal and state court decisions 2. Trump and his allies tried https://t.co/yHwgnTEMto",,,,,,,,,,,,,,
,,"Did you know that during Trump’s first term, he prioritized deporting families over felons? To make room in immigration detention for asylum seekers and separated families, his administration quietly released many more noncitizens with criminal records than President Biden ever https://t.co/RdJZZnfuTr",,,,,,,,,,,,,,
,,You missed this part from RM @RepRaskin’s opening: https://t.co/oMp5jpcCfj,,,,,,,,,,,,,,
,,Ranking Member @RepRaskin delivers opening remarks at today's subcommittee hearing on immigration enforcement. https://t.co/wWswMrtRUB,,,,,,,,,,,,,,
,,.@RepZoeLofgren delivers opening remarks at today's subcommittee hearing on immigration enforcement. https://t.co/MtV4Ht4HON,,,,,,,,,,,,,,
,,"Tom Homan, who ran Trump’s first “zero tolerance” policy that separated more than 5,000 children from their parents, is back. This time, he’s Trump’s new border czar, ready to double down on the chaos and cruelty. https://t.co/IpCfNzsDRL",,,,,,,,,,,,,,
,,.@RepRaskin cuts through the MAGA lies: unlawful border crossings are down from when Trump left office in 2021. https://t.co/6a2eY8hbzE,,,,,,,,,,,,,,
,,This concept was added to the Constitution after the Civil War to overturn the Dred Scott decision and make us a democratic nation based on place of birth rather than race of birth.,,,,,,,,,,,,,,
,,First day in office and Donald Trump is attacking the Fourteenth Amendment and birthright citizenship. https://t.co/Qo8DtEOFjj,,,,,,,,,,,,,,
,,".@RepRaskin: Let's make it a lot, lot harder to get into America illegally and a lot easier to get into America lawfully. That's what America wants to see. https://t.co/vmnX1g1CLk",,,,,,,,,,,,,,
,,"Trump’s last border policy ripped families in half. Years later, over 1,000 children still remain separated from their parents. This is the enduring cruelty and chaos of Trump’s sadistic determination to divide us. https://t.co/eF8chIKCWd",,,,,,,,,,,,,,
,,"Democrats have consistently pursued bipartisan solutions to fix immigration, while Trump’s executive orders only create chaos at the border by cutting lawful pathways. Americans deserve comprehensive reform. Instead, they are getting more dysfunction disguised as leadership. https://t.co/VjjjCSuc5k",,,,,,,,,,,,,,
,,.@RepRaskin: Let's not use immigration to destroy our Constitution. https://t.co/HffmPI2uDJ,,,,,,,,,,,,,,
,,"Donald Trump declared that we “have no choice” but to deport all undocumented immigrants in the U.S., even suggesting kicking American children out of their own country if they have parents or siblings targeted for deportation. https://t.co/TVOwegdFJy",,,,,,,,,,,,,,
,,NEWS: Ranking Member Raskin’s statement on the Trump Administration’s day one executive orders,,,,,,,,,,,,,,
,,"The pseudo-populism of billionaire Trump morphs into the techno-feudalism of Elon Musk and the broligarchs. When Trump told MAGA to vote one last time, did he mean the cyberbarons of the “dark Enlightenment” would take it from here and rule over us? https://t.co/VEyLqTkt5c",,,,,,,,,,,,,,
,,https://t.co/Ph8ME4wTyk,,,,,,,,,,,,,,
,,,,,,,,,,,,,,,,
,,Ranking Member @RepRaskin delivers his opening statement during today’s bicameral spotlight hearing examining the Trump Administration’s attack on the rule of law and the brave Americans who uphold it. https://t.co/AqaHquhysN,,,,,,,,,,,,,,
,,"LIVE NOW: Ranking Member @RepRaskin, @SenAdamSchiff, and House and Senate Democrats lead bicameral spotlight hearing on Trump's assault on the rule of law. https://t.co/ecWkoCrzoT",,,,,,,,,,,,,,
,,"Trump is taking a wrecking ball to the Department of Justice, firing career prosecutors, rewarding allies, and punishing dissent. Today, Ranking Member @RepRaskin and @SenAdamSchiff will hear from some American patriots at 3:30 PM ET, who are bravely speaking up to expose",,,,,,,,,,,,,,
,,NEWS: Read Ranking Member @RepRaskin’s statement on DOJ’s intimidation campaign against wrongfully fired former DOJ Pardon Attorney Liz Oyer: https://t.co/Rs7509Irfz,,,,,,,,,,,,,,
,,NEWS: Ranking Member @RepRaskin and @SenBlumenthal demand answers after Trump coerces big law firms into submission as part of his escalating assault on the rule of law. https://t.co/0p03G3FxWm,,,,,,,,,,,,,,
,,"DOGE set its sights on ransacking another independent agency, the Federal Trade Commission, showing contempt for privacy, consumer protection and antitrust law. Trump appears to be handing Musk access to his competitors’ most sensitive data. As a government “employee,” Elon Musk",,,,,,,,,,,,,,
,,"NEWS: A federal court ordered the U.S. government to bring back a Maryland man, a legal resident of the U.S., to his American wife and child after he was unlawfully shackled and sent to a Salvadoran mega-prison. We have to defend Due Process for noncitizens or we’ll lose Due",,,,,,,,,,,,,,
,,"A well-trained Trump underling: Declare reports of news “fake news,” profanely berate anyone who answers the phone, evade personal responsibility, play the victim, never respond to Congressional oversight requests.",,,,,,,,,,,,,,
,,"Trump’s taken corruption to championship levels: he’s not just pardoning corporate criminals—he’s pardoning criminal corporations in what appears to be a first in our history! Trump's message to fellow fraudsters in the new Gangster State: Pay up, stand by and you’ll have a free",,,,,,,,,,,,,,
