Post id,Date,post_text,Link,Impressions,Likes,Engagements,Bookmarks,Share,New follows,Replies,Reposts,Profile visits,Detail expands,Url clicks,Hashtag clicks,Permalink clicks
1877122749216280000,YYYY-00-DD 00:00:SS,"On Monday, Congress met to certify the presidential election. Democrats didn't try to overthrow the election because we're constitutional patriots. And we'll always stand strong for the Constitution against lawlessness and corruption. https://t.co/uqJXaeKnow",https://x.com/RepRaskin/status/1877122749216276986,92394,866,3366,34,3,23,1073,188,162,824,226,0,0
1876642836013290000,YYYY-00-DD 00:00:SS,"House Democrats will always stand strong for constitutional freedom, constitutional democracy and the pursuit of the common good. https://t.co/s5c1orkMWP",https://x.com/RepRaskin/status/1876642836013289963,80584,3088,8334,50,2,19,2491,703,150,1057,27,0,0
1876256462001100000,YYYY-00-DD 00:00:SS,"On the anniversary of the insurrection to overthrow the 2020 election, this article shows that Trump’s choice for FBI director promotes conspiracy theories claiming that the FBI—not Trump, the Proud Boys or the mob—was responsible for the mass violence against our democracy.",https://x.com/RepRaskin/status/1876256462001098928,508811,8148,20834,227,30,21,5243,2757,968,3654,2,0,0
1875326575152860000,YYYY-00-DD 00:00:SS,VA Secretary Denis McDonough has dedicated his career to service of all our people. #MD08 and the nation salute you as our Local Hero. https://t.co/irFHyA05pO,https://x.com/RepRaskin/status/1875326575152857268,31185,403,925,6,3,0,135,65,25,95,7,17,0
1875309334466640000,YYYY-00-DD 00:00:SS,"Today I proudly took the oath of office to represent the remarkable people of Maryland’s 8th district. As the new Ranking Member on the House Judiciary Committee, I will defend constitutional democracy and freedom and champion the common good. Thank you for this high honor. https://t.co/ZdfgriFMxI",https://x.com/RepRaskin/status/1875309334466638279,169033,11008,16805,43,22,5,1816,1289,527,1091,20,0,0
1873757892429360000,YYYY-00-DD 00:00:SS,"Swimmer extraordinaire @katieledecky is a nine-time Olympic gold medalist, 21-time world champion gold medalist and our final #MD08 Local Hero of 2024. MoCo’s beaming proud of you, Katie—thanks for making a splash as our crowning Local Hero of the Year. https://t.co/DOJHype0u2",https://x.com/RepRaskin/status/1873757892429361351,39007,1327,2640,14,9,10,169,174,84,299,17,34,0
1873485342508280000,YYYY-00-DD 00:00:SS,"America mourns sharply the loss of President Jimmy Carter. A leader of soaring integrity and passionate devotion to human rights, his legacy already sparkles like a diamond in the rough. With millions of Americans, I send love and gratitude to the Carter family.",https://x.com/RepRaskin/status/1873485342508278130,42447,985,1513,10,0,1,106,175,59,183,4,0,0
,,,,,,,,,,,,,,,,
,,"NEWS: RM @RepRaskin is demanding urgent answers regarding the Trump Administration’s reckless usage of Signal to discuss attack plans in a group chat that included a journalist, likely in violation of the Espionage Act and Federal Records Act, and whether the DOJ and the FBI have",,,,,,,,,,,,,,
,,"Republicans are trying to pass a sweeping bill to expand the concealed carrying of firearms across the country. Watch @RepLucyMcBath explain why law enforcement opposes this bill, which would make officers' jobs more difficult and make Americans less safe. https://t.co/QGsoZycf8S",,,,,,,,,,,,,,
,,"Every day, we lose more than 100 Americans to gun violence. More than 3000 people have died from gun violence already this year. Yet Republicans are trying to change concealed carry laws that will make our communities more dangerous places to live. @RepLucyMcBath explains: https://t.co/ZoGS0gUvtx",,,,,,,,,,,,,,
,,".@RepBeccaB calls out House Republican leaders for refusing to hang a plaque honoring the Capitol Police for their sacrifices on January 6. The GOP claims to back the blue, yet they refuse to honor the officers who defended democracy. https://t.co/43f2vBdRKZ",,,,,,,,,,,,,,
,,"When a president calls to end birthright citizenship, he's not defending the Constitution—he’s attacking it. @RepRaskin explains why Trump is treating the Constitution like a minor inconvenience. https://t.co/K59hx4afu8",,,,,,,,,,,,,,
,,"NEWS: RM @RepRaskin’s statement on Judge Boasberg's rejection of Trump's bid to continue deporting individuals to mass prisons in El Salvador without due process, abusing an obscure wartime law: https://t.co/huLSIQfs1Q",,,,,,,,,,,,,,
,,Elon Musk and DOGE are gutting the agency that protects America’s nuclear arsenal. These reckless cuts aren’t just cruel—they directly threaten our national security. https://t.co/mwmxKwm7mq,,,,,,,,,,,,,,
,,BREAKING: Ranking Members @RepRaskin and @FrankPallone demand Trump immediately reinstate two Commissioners at the Federal Trade Commission: https://t.co/tk9Vn4CzFH,,,,,,,,,,,,,,
,,"In dozens of cases, federal judges have stopped Trump's illegal and unconstitutional power grabs. These judges were appointed by Republican presidents, Democratic presidents, even Trump himself. Across the political spectrum, from liberal judges to conservative judges, serious https://t.co/Yy8GLCHfhJ",,,,,,,,,,,,,,
,,"The Trump Administration wants to allow potentially dangerous individuals, including convicted felons, fugitives, and domestic abusers—especially if they are loyal to Trump—to acquire, own, and possess firearms, undermining public safety and 30 years of bipartisan congressional",,,,,,,,,,,,,,
,,"The Constitution doesn’t make the president a King. Under Article II, the president’s job isn’t to rule over us but to faithfully execute the laws Congress passes. @RepRaskin breaks down why that separation of functions still defines American democracy. https://t.co/9jzhZbEaZT",,,,,,,,,,,,,,
,,RM @RepRaskin warns Trump: Defying court orders won’t just be illegal—it could cost government officials personally in serious ways. https://t.co/vojpZht7eK,,,,,,,,,,,,,,
,,"DOGE has been operating in secret while they dismantle the federal government and manipulate Americans' private data. House Judiciary RM @RepRaskin and House Oversight RM @GerryConnolly just told DOGE: no more games, that’s the people’s data. https://t.co/pA7d1edmPr",,,,,,,,,,,,,,
,,"Today, Trump has again tried to rewrite the laws to his liking by firing two commissioners of an independent agency, the Federal Trade Commission. Commissioners Bedoya and Slaughter can only be removed for cause, but Trump thinks he can sack any agency commissioner at any time",,,,,,,,,,,,,,
,,"DOGE ignored basic Congressional oversight requests, refuses to meet with Democrats, and operates in secrecy. If they won't tell us the truth, we'll FOIA it. https://t.co/Su0Jor2xf9",,,,,,,,,,,,,,
,,Elon Musk and his confederates think democracy is defunct and that it’s time for regime change. @RepRaskin exposes the Silicon Valley billionaires’ push to replace our Constitution with techno-state dictatorship. https://t.co/FrpT6ZRTdl,,,,,,,,,,,,,,
,,RM @RepRaskin responds to Trump and House Republicans’ crusade to undermine the independent judiciary: https://t.co/SrlyonBQId,,,,,,,,,,,,,,
,,"Every American has the right to demand transparency and accountability from our government by filing a request for government records under the Freedom of Information Act (FOIA). Today, House Judiciary RM @RepRaskin and House Oversight RM @GerryConnolly did just that. DOGE https://t.co/qOtTgPijnf",,,,,,,,,,,,,,
,,We just FOIA'ed DOGE. House Judiciary RM @RepRaskin and House Oversight RM @GerryConnolly are demanding DOGE provide straight answers to the American people on their shady operations. https://t.co/RQwKw24HDm https://t.co/g5fKN4ipMj,,,,,,,,,,,,,,
,,"Never before has a president gone to DOJ to attack his political foes, much less lay out a plan for prosecuting them. These dictatorial tactics are a desecration of the Department of Justice and threaten the Rule of Law in America, which is all about holding our rulers",,,,,,,,,,,,,,
,,"Last week, Trump went to DOJ to proclaim his legal hit list. As his losing streak deepens in court, Trump lashes out at major law firms who represent or employ his perceived foes. He’s targeting lawyers despite having been warned by a federal judge that such actions are unlawful",,,,,,,,,,,,,,
,,"To be upheld, Trump’s invocation of the Alien Enemies Act of 1798 here depends on America being at war with Venezuela. But Congress has declared no such war. There are lots of lawful ways to promote public safety and national security, but this is a lawless and reckless",,,,,,,,,,,,,,
,,LIVE NOW: WATCH RM @REPRASKIN DELIVER REBUTTAL TO TRUMP'S DOJ SPEECH ⤵️ https://t.co/fov8dcow6l,,,,,,,,,,,,,,
,,"The Administration says its mass deportation targets criminals, “the worst of the worst.” How does removing a sick American child and her family make us any safer?",,,,,,,,,,,,,,
,,NEW: Ranking Member @RepRaskin’s statement on the Trump Administration’s cruel deportation of a U.S. child with cancer: https://t.co/Mv4nzEKZij,,,,,,,,,,,,,,
,,NEWS: RM @RepRaskin demands immediate investigation into interim U.S. Attorney Edward Martin’s brazen ethical violations and abuse of power⤵️,,,,,,,,,,,,,,
,,"The Constitution makes clear the president isn’t a king. He can’t ignore, trash or rewrite the laws. @RepRaskin explains why GOP leaders don’t want you to remember that. https://t.co/g4kwcQAz07",,,,,,,,,,,,,,
,,NEW: Read RM @RepRaskin's statement on Trump’s purge of DOJ’s top corruption fighters: https://t.co/dcLp8gVVpf,,,,,,,,,,,,,,
,,".@RepRaskin warns Trump: Officials who defy court orders could face personal civil and criminal penalties, including fines that taxpayers won’t cover. https://t.co/X62GQIKLoc",,,,,,,,,,,,,,
,,Ranking Member @RepRaskin reminds Trump: Officials who violate court orders may face civil and criminal penalties. https://t.co/QyMHgb7ncw,,,,,,,,,,,,,,
,,"Rather than conform his actions to the rule of law, Donald Trump is going after the lawyers taking him on in court. @RepRaskin explains Trump's latest effort to rule like a dictator: punishing the people brave enough to challenge him in court and uphold the law. https://t.co/poOKWzDRpl",,,,,,,,,,,,,,
,,"NEWS: ""We cannot allow this nation to slide into a system of presidential authoritarianism, where people are seized at their homes, arrested, and detained simply for expressing disfavored political viewpoints..."" -@RepRaskin’s statement on the Trump Administration’s detainment",,,,,,,,,,,,,,
,,.@RepChuyGarcia explains why he opposes granting the NCAA an antitrust exemption that prohibits athletes from being recognized as employees. https://t.co/qIm7MwYWBD,,,,,,,,,,,,,,
,,.@RepRaskin fact-checks House Republicans on the Constitution: The president is NOT a king. His job is to execute and enforce the law—not rewrite or ignore it. https://t.co/MPKfH6ZHHP,,,,,,,,,,,,,,
,,"Trump pretends to back free speech, but that’s a joke. His actions—like banning the AP from the Oval Office for saying 'Gulf of Mexico'—show a will to silence dissent. We don’t ban and punish words in America. https://t.co/50dizmSKNJ",,,,,,,,,,,,,,
,,"If you didn’t see DOGE as a public safety emergency before, check again. Mass layoffs wiped out air traffic controllers, nuclear safety inspectors, FDA regulators, VA cancer researchers, and suicide prevention counselors. Now, cuts threaten the security of weapons of mass",,,,,,,,,,,,,,
,,"Young America knows there’s no future with Elon Musk, Donald Trump and their Cabinet of billionaires and fanatics.",,,,,,,,,,,,,,
,,".@RepRaskin sets the record straight: In America, Congress makes the laws. The President’s job is to take care that the laws are faithfully executed—not thwarted, frustrated and trashed. https://t.co/92GiDlTOgH",,,,,,,,,,,,,,
,,"Trump signed an Executive Order punishing Perkins Coie—a major law firm working on challenging some of Trump’s executive actions in court—by suspending their security clearances, barring them from federal buildings, and preventing the federal government from hiring or contracting",,,,,,,,,,,,,,
,,"Yesterday, Trump issued an unprecedented memorandum directing government agencies to seek financial damages from Americans who seek justice in the courts. @RepRaskin: “By threatening to seek costs and damages from private litigants, Donald Trump is trying to scare Americans out",,,,,,,,,,,,,,
,,".@RepRaskin: ""Stung by his accelerating losses in court—now more than 40 and counting—the President’s response is to exact revenge against the people he blames for his predicament—the lawyers and litigants who have stopped him. This is dangerous as hell.""",,,,,,,,,,,,,,
,,"NEWS: Ranking Member @RepRaskin’s statement on Trump’s retaliation against law firms, intimidation of Americans who dare to challenge him in court. https://t.co/IFoGRHaV2E",,,,,,,,,,,,,,
,,Some tech billionaires think it’s time to scrap the U.S. Constitution and create a techno-monarchy. @RepRaskin exposes their dark vision for America. https://t.co/RlcJCOb6M7,,,,,,,,,,,,,,
,,".@RepRaskin explains why Republicans are ramping up their attacks on the judicial branch—and what it has to do with Donald Trump's (and Elon Musk's) pursuit of absolute, unchecked power. https://t.co/gEoN7gV5gy",,,,,,,,,,,,,,
,,".@RepBeccaB calls out a GOP bill that would give presidents immunity—even for sexual assault. No one, not even a president, should be above the law. https://t.co/ozArHwh9Ux",,,,,,,,,,,,,,
,,Watch @RepDanGoldman call out the GOP's baseless claims about Trump's criminal conviction. https://t.co/UiL4mKwSZq,,,,,,,,,,,,,,
,,Ranking Member @RepRaskin delivers opening remarks during today’s hearing on Republicans’ new bill to allow Trump and his corrupt cronies to pick the court that hears their cases. https://t.co/zDbajZnuIo,,,,,,,,,,,,,,
,,Ranking Member @RepMGS delivers opening remarks during today’s hearing on Republicans’ legislative reforms to rig the rules for Trump and his corrupt cronies. https://t.co/K64sCH587j,,,,,,,,,,,,,,
,,"Former Deputy Director of the White House Office of Gun Violence Prevention Gregory Jackson, Jr. outlines the public safety consequences of abolishing the ATF. https://t.co/0yYSsPebnh",,,,,,,,,,,,,,
,,Ranking Member @RepRaskin delivers opening remarks at today’s hearing on Republican efforts to dismantle proven gun safety laws and make communities less safe. https://t.co/6kom175RWN,,,,,,,,,,,,,,
,,Ranking Member @RepLucyMcbath delivers opening remarks at today’s hearing on Republican efforts to dismantle proven gun safety laws and make communities less safe. https://t.co/2RcME3UgSu,,,,,,,,,,,,,,
,,"Is the FAA handing Musk a $2.4 billion payday? The FAA, with contracts already signed with Verizon, is making moves to favor Musk’s Starlink for a massive contract—raising stark conflict-of-interest questions. https://t.co/bxRHXWxzmx",,,,,,,,,,,,,,
,,"NEW: In letter to AG Bondi, Ranking Members @RepRaskin and @RepLucyMcBath press for details on Trump Executive Order threatening life-saving gun regulations⤵️",,,,,,,,,,,,,,
,,"NEW: In letter to AG Bondi, Ranking Members @RepRaskin and @RepJasmine demand answers on DOJ’s corrupt bargain with Mayor Adams and attempted cover-up ⤵️",,,,,,,,,,,,,,
,,"Mass layoffs. Air traffic controllers and nuclear safety inspectors fired. Food and Drug Inspectors, VA cancer researchers and suicide prevention counselors sacked. Public services demolished. DOGE is a public safety crisis. https://t.co/YYdg3t47lh",,,,,,,,,,,,,,
,,"Trump’s DOJ is demoting outstanding prosecutors and dedicated civil servants simply because they prosecuted insurrectionist cop beaters, Proud Boys and seditious conspiracists. They’re being punished for doing their jobs. https://t.co/w9onilHEsr",,,,,,,,,,,,,,
,,A day of infamy and shame turns the Oval Office into the Evil Office. The White House needs an exorcism. https://t.co/RSqQeHvdUc,,,,,,,,,,,,,,
,,"The Consumer Financial Protection Bureau has returned $21 billion to over 205 million Americans—protecting them from scams and frauds at the hands of large banks, loan servicers, debt collectors, and payday lenders. Now, Trump and Elon Musk are trying to shut it down—even as https://t.co/UXy78awTwC",,,,,,,,,,,,,,
,,"NEW: RM @RepRaskin, @RepJoeNeguse, @RepMaxineWaters, and @RepJeffries led an amicus brief joined by 198 House Democrats in defense of American consumers and the Consumer Financial Protection Bureau ⤵️",,,,,,,,,,,,,,
,,Ranking Member @RepRaskin delivers his opening statement during today’s hearing on combatting human trafficking and online exploitation. https://t.co/wLz5VgtXP9,,,,,,,,,,,,,,
,,Ranking Member @RepLucyMcBath delivers opening remarks during today’s hearing on protecting victims of human trafficking and online exploitation. https://t.co/9MPCcRuqQQ,,,,,,,,,,,,,,
,,Ranking Member @RepRaskin Issues Statement on Trump’s Retaliation Against Law Firm that Aided Jack Smith: https://t.co/pmkmNlD1Vj,,,,,,,,,,,,,,
,,RM @RepRaskin rebukes Judiciary Republicans for suddenly losing their zeal for congressional oversight now that Trump's DOJ is embroiled in a massive quid pro quo and cover-up scandal. Their silence on the litany of Trump's lawless actions speaks volumes. https://t.co/qW1rgpWfRC,,,,,,,,,,,,,,
,,RM @RepRaskin reminds the GOP: Trump and Musk don't really care about stopping fraud—their first move was firing the 17 inspectors general whose job is to root it out. https://t.co/yYzzwlg7DM,,,,,,,,,,,,,,
,,".@RepJerryNadler is right: The Trump Administration is torching the law with Shadow President Musk by his side. Elon Musk was never appointed, never confirmed by the Senate—yet he’s been given the power to dismantle agencies created by Congress. https://t.co/MOy6AcjvhF",,,,,,,,,,,,,,
,,RM @RepRaskin explains how Elon Musk isn’t holding the government accountable—he’s exploiting it for BILLIONS while putting Americans’ private data at risk. And Republicans are enabling him. https://t.co/3WxREp4lLD,,,,,,,,,,,,,,
,,RM @RepRaskin explains how Elon Musk isn’t holding the government accountable—he’s exploiting it for BILLIONS while putting Americans’ private data at risk. And Republicans are enabling him https://t.co/qpnqiMpgQF,,,,,,,,,,,,,,
,,".@RepDeborahRoss explains how the legislative branch is meant to be a check on the executive branch, not serve it blindly. https://t.co/Eg3THUnLHx",,,,,,,,,,,,,,
,,"RM @RepRaskin explains how the Trump Administration has turned the DOJ into a weapon for political revenge. Cop beaters are being pardoned, while Federal prosecutors who held January 6th rioters accountable are being unlawfully fired. https://t.co/LowVIMX7BF",,,,,,,,,,,,,,
,,".@RepBeccaB sounds the alarm: Trump’s executive order to curb birthright citizenship is unconstitutional, lawless, and a direct attack on the values that define our nation. https://t.co/j3LcfLu4hY",,,,,,,,,,,,,,
,,".@RepJayapal makes it clear: Trump’s executive order attempting to revoke birthright citizenship is unconstitutional, lawless, and would overturn a foundational American value. The 14th Amendment isn’t a suggestion—it’s a constitutional right. https://t.co/OVcVM8qy4v",,,,,,,,,,,,,,
,,Ranking Member @RepRaskin delivers opening remarks during today’s hearing on Trump’s lawless Department of Justice. https://t.co/v1ldPR4PV6,,,,,,,,,,,,,,
,,Ranking Member @RepJasmine delivers opening remarks during today’s hearing on Trump using the Department of Justice to fulfill his demands for revenge and retribution. https://t.co/MxJJLxniXB,,,,,,,,,,,,,,
,,BREAKING: Ranking Member @RepRaskin releases new report: President Trump’s New Gilded Age: How Trump’s Department of Justice is Promoting Political and Corporate Corruption to Benefit His Most Loyal Supporters https://t.co/BNmsNz8L9T https://t.co/x6KSguaQyn,,,,,,,,,,,,,,
,,Ranking Member @RepMGS delivers opening remarks at today’s hearing regarding Trump’s unconstitutional attempt to revoke the 14th Amendment’s guarantee of birthright citizenship. https://t.co/UXMrsduJJb,,,,,,,,,,,,,,
,,.@RepZoeLofgren exposes how Trump and Musk are pushing for the impeachment of judges who won’t sign off on their lawlessness—escalating their dangerous campaign to undermine the rule of law. https://t.co/6LlWJur8J8,,,,,,,,,,,,,,
,,".@RepHankJohson warns: Trump and his allies are orchestrating a judicial power grab, threatening one of the last lines of defense against authoritarianism. An independent judiciary is on the line. https://t.co/VUXNkeaCZa",,,,,,,,,,,,,,
,,Ranking Member @RepRaskin gives his opening statement at today’s hearing on Donald Trump and Elon Musk’s attempts to manipulate our nation’s federal courts and undermine constitutional review of their rampage against the people. https://t.co/4xWow0tVg2,,,,,,,,,,,,,,
,,Ranking Member @RepHankJohnson delivers opening remarks during today’s hearing on the Trump Administration’s efforts to undermine our federal courts. https://t.co/y6T9tUhz44,,,,,,,,,,,,,,
,,"Dan Bongino, a right-wing podcaster, election denier, and conspiracy theorist, was picked to serve as the FBI’s new deputy director—a position traditionally held for a career FBI agent. But those people are being targeted by Kash Patel for working on the J6 cases. Trump wants",,,,,,,,,,,,,,
,,White House: Musk is not an employee of DOGE and has no authority. So who exactly is in charge at DOGE? What is Musk’s role? https://t.co/32jOWjVPUm,,,,,,,,,,,,,,
,,"Elon Musk on recent FAA firings: “To the best of our knowledge, no one affecting safety has been fired.” Relying on the best of Musk’s thin knowledge is a faultymetric; see firings of key nuclear personnel. https://t.co/qR4QAjfyba",,,,,,,,,,,,,,
,,.@RepRaskin exposes Elon Musk and DOGE for their anticorruption charade: “The most glaring conflict of interest of all is that Elon Musk is a government contractor himself who collects billions of dollars from the US government.” https://t.co/oBljN7kbA7,,,,,,,,,,,,,,
,,"Do you remember when Elon Musk pressured the last FAA chief to resign due to the FAA’s advocacy of over $600,000 in fines for SpaceX? Now, with the latest round of DOGE cuts, hundreds of FAA employees have been laid off. Given the opaqueness of Musk’s actions, you can’t help",,,,,,,,,,,,,,
,,"The incompetence of Musk-Trump only exacerbates their malice. Putin, Xi and the extreme Right must be delighted that the Trump Administration is not only embracing them but recklessly jeopardizing our own national security.",,,,,,,,,,,,,,
,,"Oops! Trump and Musk sacked over 300 staffers at the Department of Energy, not quite grasping they took care of the nation’s nuclear stockpile. Now, they want to rehire them but can’t find them because these geniuses deleted the workers’ email and failed to obtain their new",,,,,,,,,,,,,,
,,"Camping reservations are halted, personnel are in short supply, and public bathrooms could be locked. They’re not just shutting down access to government, they’re shutting down access to nature.",,,,,,,,,,,,,,
,,"Yosemite National Park, one of our great national treasures, is in chaos thanks to President Trump’s lawless and indiscriminate hiring freeze across the federal government. https://t.co/KGSyl4hTJN",,,,,,,,,,,,,,
,,"Canceled flight? Thanks to a rule from the Biden era, the Department of Transportation ensured you received a refund. Don’t get used to it, all thanks to House Republicans using a legislative maneuver to try to roll back this regulation and allow airlines to inconvenience you https://t.co/41xz1q3ZmM",,,,,,,,,,,,,,
,,Trump says he decides what the law is. Here’s Chief Justice John Marshall in Marbury v. Madison (1803): “It is emphatically the province and duty of the judicial department to say what the law is.” Somebody in the Musk-Trump administration should read that decision. https://t.co/w4SD7NCXXd,,,,,,,,,,,,,,
,,"Credit card late fees: Should they be $32 or $8? The Biden Administration cut those fees down to $8, but House Republicans just passed a bill to facilitate destruction of that rule. @RepRaskin breaks it down: https://t.co/gUKbIWMAwJ",,,,,,,,,,,,,,
,,Inflation’s out of control—but not just eggs. The price of corruption just went up $10 million as Trump’s shakedowns of the media continue. Musk pays Trump $10 million for the totally First Amendment-protected activity of Twitter deciding not to platform him as an impeached,,,,,,,,,,,,,,
,,"Ranking Member @RepRaskin confirms what everyone in Congress knows: Republicans have NO AGENDA in this Congress to bring down prices or solve any problems they talked about in the campaign, so they simply abdicate their authority to Elon Musk and his teenage computer hackers. https://t.co/bVMkVtqEIA",,,,,,,,,,,,,,
,,Trump keeps his tax returns secret but wants to give your IRS info to Elon Musk. What could go wrong with that? https://t.co/u35rJeYF62,,,,,,,,,,,,,,
,,BREAKING: Ranking Member @RepRaskin demands Attorney General Bondi halt illegal intimidation campaign targeting the DOJ’s Public Integrity Office. https://t.co/cXCYqc99BB,,,,,,,,,,,,,,
,,"To the lawyers in the Public Integrity Section—Stand strong for the Constitution and public integrity, and stand strong against the rampant corruption and lawlessness flowing from the White House into your storied workplace. The times have found you at a critical juncture.",,,,,,,,,,,,,,
,,"NEWS: Ranking Member @RepRaskin’s Statement on the Resignation of SDNY Attorney Following Stunning Trump DOJ Quid Pro Quo, Cover-Up. https://t.co/fFLPuoSU6e",,,,,,,,,,,,,,
