Post id,Date,post_text,Link,Impressions,Likes,Engagements,Bookmarks,Share,New follows,Replies,Reposts,Profile visits,Detail expands,Url clicks,Hashtag clicks,Permalink clicks
1904995359019130000,YYYY-00-DD 00:00:SS,"Medicare, Medicaid and Social Security are the magnificent achievements of American democracy. There's no way the American people will let Elon Musk and Trump's billionaire cabinet tear down what prior generations have built. https://t.co/VTbGbuir6v",https://x.com/RepRaskin/status/1904995359019131318,7450,330,590,3,3,0,47,130,9,60,1,0,0
1904974213296880000,YYYY-00-DD 00:00:SS,"Trump is imposing an ultimatum on judges: agree with my bogus analysis of the law or face impeachment. Never has a judge been impeached over doctrinal differences—in other words, for doing their jobs. MAGA now wants to make sound legal analysis a high crime and misdemeanor. https://t.co/hFaP3tSL2S",https://x.com/RepRaskin/status/1904974213296877734,15542,927,1582,18,3,0,81,359,9,135,2,0,0
1904924139820850000,YYYY-00-DD 00:00:SS,https://t.co/ttPuHvdA1a,https://x.com/RepRaskin/status/1904924139820851582,50163,1913,2992,29,10,0,144,391,69,248,47,0,0
1904923616979930000,YYYY-00-DD 00:00:SS,We are being governed by incompetents and broligarchs who would start World War III with a pocket dial. https://t.co/caE6OO0CXK,https://x.com/RepRaskin/status/1904923616979927346,66981,3090,5210,43,18,3,347,937,46,334,13,0,0
1904880217191030000,YYYY-00-DD 00:00:SS,"Trump, do you want to set up a compensation fund for the 140 sworn police officers wounded by your J6 “patriots” too? Or is it just the criminals you’re proposing to pay reparations? Why should the taxpayers pay for the upkeep of your mercenary gang?",https://x.com/RepRaskin/status/1904880217191035063,52424,3704,5758,58,23,0,285,1416,49,302,2,0,0
1904668659189970000,YYYY-00-DD 00:00:SS,"On Equal Pay Day, I'm proud to uplift the @DemWomenCaucus' unflagging fight for fair wages for all women. Ending the gender pay gap means equal pay for equal work.",https://x.com/RepRaskin/status/1904668659189973061,21545,219,434,2,0,0,83,47,22,63,0,0,0
1904653462152880000,YYYY-00-DD 00:00:SS,Trump's promising that Elon Musk won't break Social Security with his DOGE redesign. But this wouldn't be the first time the billionaire broke something he promised was unbreakable. https://t.co/TA7azbobPB,https://x.com/RepRaskin/status/1904653462152880491,66402,1663,3479,37,5,0,263,434,111,440,14,0,0
1904528504978290000,YYYY-00-DD 00:00:SS,"Both Terps teams keep dancing! After two big finishes, can’t wait to watch our Terrapins bring their fighting spirit to the Sweet Sixteen.",https://x.com/RepRaskin/status/1904528504978284900,23468,154,296,1,0,0,60,18,15,49,0,0,0
1904367794780590000,YYYY-00-DD 00:00:SS,"To be called a conspiracy theorist by you is high praise! Of course, your vaccine conspiracy lies put people’s lives at risk. Meantime, you have no problem with Trump taking over Canada, Greenland and Panama, but seem to know the real purpose of this deranged plan. Pray tell!",https://x.com/RepRaskin/status/1904367794780586261,34706,1034,1800,14,8,0,212,184,51,313,5,0,0
1904277415012240000,YYYY-00-DD 00:00:SS,History shows a legislative strategy alone is not sufficient to defeat fascists and dictators. You need organized civil society fighting back along with persistent legislative defense of democratic institutions and programs. https://t.co/l362aFKW98,https://x.com/RepRaskin/status/1904277415012237717,29126,1377,2641,31,6,10,259,480,43,308,4,0,0
1904234552266300000,YYYY-00-DD 00:00:SS,"Trump’s corporate state uses the White House lawn for a Tesla auto show, promotes Tesla stock on TV and hustles Trump deals globally. Americans can't afford groceries or medicine, but the president has turned the government into a moneymaking operation for MAGA billionaires.",https://x.com/RepRaskin/status/1904234552266301451,14658,220,503,6,1,0,82,67,13,118,3,0,0
1904169599051980000,YYYY-00-DD 00:00:SS,"Trump froze shipment of millions of dollars’ worth of food to hungry Americans, including 12 truckloads slated for Maryland. What do we tell hungry families? The president is spending billions on shocking military boondoggles but feeding the hungry is “government waste.”",https://x.com/RepRaskin/status/1904169599051985375,20766,313,710,14,6,1,55,162,13,165,1,0,0
1903918714916940000,YYYY-00-DD 00:00:SS,"15 years ago today, Democrats passed the Affordable Care Act to make health care more affordable for millions of Americans. While Trump, Musk and MAGA wage war on Medicare &amp; Medicaid, we’ll keep fighting for health care as a right, not a privilege.",https://x.com/RepRaskin/status/1903918714916938006,47347,2305,4047,31,2,3,750,511,97,377,2,0,0
1903250352863940000,YYYY-00-DD 00:00:SS,Grok confirms that the Trump push to make $880 billion in Medicaid cuts is true. Why do Trump &amp; Musk try to deny the targeting of Medicaid and Social Security when that is their own plan? Own it.,https://x.com/RepRaskin/status/1903250352863936658,61204,2022,3769,34,3,0,292,919,48,486,1,0,0
1903184723720940000,YYYY-00-DD 00:00:SS,Dr. Sarah Cooley is an acclaimed climate scientist who was unceremoniously sacked from NOAA by Trump and DOGE while conducting critical research to save our oceans. This #MD08 Local Hero is determined to use her expertise in service of the American people and our climate. https://t.co/cONRE9jrjN,https://x.com/RepRaskin/status/1903184723720937733,29836,1429,2280,22,4,1,153,472,26,108,3,16,0
1903092280770070000,YYYY-00-DD 00:00:SS,Are other billionaires deeply invested in China getting this briefing too? Will China be represented at the briefing or will Musk give them a read-out afterwards? https://t.co/Xc9w0MLTIR,https://x.com/RepRaskin/status/1903092280770072611,13380,415,1061,4,9,0,103,159,23,194,164,0,0
1903090358109530000,YYYY-00-DD 00:00:SS,"We rallied outside NOAA’s HQ in Silver Spring to defend facts &amp; science, democracy &amp; the rule of law. Trump &amp; Elon Musk must reinstate the federal workers they illegally sacked from the agency. We're not letting NOAA go down—Congress &amp; the people created it &amp; we’ll defend it. https://t.co/Gg7hzC4QZt",https://x.com/RepRaskin/status/1903090358109532227,20991,740,1360,5,3,0,138,218,28,124,4,0,0
1902778384901390000,YYYY-00-DD 00:00:SS,"President Trump attacked the Department of Education and conjured up chaos for public servants eligible for loan forgiveness. But loan forgiveness remains intact, and Democrats are fighting to honor eligible public servants' careers and well-being.",https://x.com/RepRaskin/status/1902778384901390449,19958,911,1539,8,2,3,210,232,31,150,2,0,0
1902742620419340000,YYYY-00-DD 00:00:SS,"Every American has the right to know what DOGE is doing with their personal information. I submitted a Privacy Act request to DOGE, demanding they tell me why they have my Social Security number and direct deposit information. https://t.co/rPfEHBrb03",https://x.com/RepRaskin/status/1902742620419338375,300367,11740,26962,329,88,20,5766,4276,807,2770,1555,1,0
1902437006690400000,YYYY-00-DD 00:00:SS,"Patients benefit from the Agency for Healthcare Research and Quality, which helps to reduce medical errors, protect patient safety, and make care more affordable. I joined @SenBlumenthal and @RepDonBeyer in sending a message to Trump and DOGE last week: hands off AHRQ! https://t.co/oAn8r7N3m6",https://x.com/RepRaskin/status/1902437006690402384,14017,379,750,11,2,0,85,121,25,98,2,0,0
1902346232166590000,YYYY-00-DD 00:00:SS,"More than 150,000 MD-08 residents rely on Medicaid for lifesaving care, yet Trump &amp; MAGA are pushing the largest cut ever. Let’s defend Medicaid with everything we’ve got. https://t.co/OWeC4KDSTp",https://x.com/RepRaskin/status/1902346232166592819,80059,4659,8734,60,6,18,1619,1395,128,617,7,0,0
1901721452568560000,YYYY-00-DD 00:00:SS,Culture war censors at Secretary Pete Hegseth's DoD are purging books and learning materials from military-run schools. Military families deserve best-in-class education access and the First Amendment rights they defend for us all. https://t.co/q7QVSdx7Ai,https://x.com/RepRaskin/status/1901721452568560108,77477,2674,6023,100,36,2,576,1367,169,725,40,0,0
1901257942688530000,YYYY-00-DD 00:00:SS,"If Vladimir Putin had a plan to foul our air and water, wreck public health and drive America over the cliff of irreversible lethal climate change, it would look exactly like Lee Zeldin’s plan. This is a plan for self-inflicted environmental disaster. https://t.co/V25nvWrKK1",https://x.com/RepRaskin/status/1901257942688530840,275293,7130,15337,344,78,11,1116,3458,324,1386,1905,0,0
1900694293381010000,YYYY-00-DD 00:00:SS,"We need strong federal, state and local teamwork to protect our people from the lawless actions of the Trump Admin—and I'm honored to call @OAGMaryland Anthony Brown my partner. Thanks to this Local Hero for standing in the breach for Marylanders. https://t.co/icpaWnkyn7",https://x.com/RepRaskin/status/1900694293381013514,37640,489,1188,7,0,2,246,107,43,171,129,0,0
1900638812054970000,YYYY-00-DD 00:00:SS,"From the halls of Congress to the communities of Southern Arizona, America mourns the painful loss of Congressman Raúl Grijalva, a passionate and undaunted servant of the people. Sending love and strength to his family. May his memory be a blessing to us all.",https://x.com/RepRaskin/status/1900638812054974785,16877,535,795,3,0,0,76,61,24,99,0,0,0
1900618722429080000,YYYY-00-DD 00:00:SS,"Public sector workers in democracies fought fascism and genocide. In totalitarian states, some went along with totalitarian crimes; some resisted. What kind of “public sector worker” will Elon Musk be? https://t.co/QMXMEfGKdZ",https://x.com/RepRaskin/status/1900618722429084051,24922,579,1600,15,0,0,295,162,55,222,286,0,0
1900565183606500000,YYYY-00-DD 00:00:SS,This is a terrible affront to the veterans posthumously dishonored and canceled and to their families. It is a pathological statement that the MAGA government cannot even accept inclusion in death. https://t.co/wiIHivctun,https://x.com/RepRaskin/status/1900565183606497409,58469,3690,9575,118,46,5,318,1492,113,718,3234,3,0
1900215640431970000,YYYY-00-DD 00:00:SS,"One day after Republicans passed a bill to slash NOAA funding, DOGE plans to cut 1,000 jobs from the agency which produces weather data and climate science. Trump thinks he can redirect hurricanes with his Sharpie but you don’t need a weatherman to know this administration blows.",https://x.com/RepRaskin/status/1900215640431972454,79044,5293,8999,60,20,80,1231,1586,203,599,0,0,0
1899984014498290000,YYYY-00-DD 00:00:SS,"I introduced legislation to help state and local governments invest in road safety efforts—in memory of Sarah Langenkamp, a fine diplomat, an amazing mother and a beloved friend. I'm grateful to her family for working with me to make our streets and community safer.",https://x.com/RepRaskin/status/1899984014498287842,29901,668,1200,7,1,1,97,150,42,185,56,0,0
1899978197506170000,YYYY-00-DD 00:00:SS,"House Dems are ready and eager to vote for a 4-week funding extension to block these devastating cuts and keep the government open, allowing us to reach a serious bipartisan compromise.",https://x.com/RepRaskin/status/1899978197506166937,41841,1748,3034,21,5,1,362,423,125,373,0,0,0
1899958805644960000,YYYY-00-DD 00:00:SS,The biggest entitlement crisis in America is Trump and Musk’s sense of entitlement—they think they own the country. But we’re going to defend Social Security and Medicare against Musk’s chainsaw as the slash-and-burn campaign continues.,https://x.com/RepRaskin/status/1899958805644955966,335977,10100,19051,145,14,36,3327,2820,899,1854,6,0,0
1899795061681910000,YYYY-00-DD 00:00:SS,"DOGE just sacked half of @usedgov’s workforce, including lawyers defending students with disabilities. If these chainsaw massacres are so popular, why don’t they bring them to Congress first? How many cases do they have to lose?",https://x.com/RepRaskin/status/1899795061681913876,123320,6110,10997,86,17,15,1266,2068,415,1108,2,0,0
1899239934277680000,YYYY-00-DD 00:00:SS,"Today, I joined Indivisible members from MoCo and across our region to stand up for democracy, federal workers and the rule of law. We are beating Musk and Trump every day in court, and we will keep going. https://t.co/2nb1a0ETqm",https://x.com/RepRaskin/status/1899239934277685444,37545,1743,3195,19,3,1,447,388,88,314,8,0,0
1898773449947970000,YYYY-00-DD 00:00:SS,Anyone who cares about the shocking resurgence of antisemitism and its relationship to the attack on democracy all over the world must read this powerful analysis of the Trump-Vance attempt to humiliate President Zelensky in the Oval Office. Tim Snyder’s analysis is devastating.,https://x.com/RepRaskin/status/1898773449947971707,19138,412,2267,43,14,0,237,131,37,608,837,0,0
1898203189817610000,YYYY-00-DD 00:00:SS,"Today, tons of Marylanders rallied at the Lincoln Memorial with Dr. Francis Collins, Bill Nye the Science Guy and thousands of others to tell MAGA to let our expert civil servant scientists get back to work, pursuing facts and conducting critical research for the common good. https://t.co/7KauxGJUhv",https://x.com/RepRaskin/status/1898203189817614543,70577,3352,7515,37,12,1,1063,816,202,1060,50,0,0
1898167910054370000,YYYY-00-DD 00:00:SS,My Joint Address guest Dr. Lauren McGee is a NIH cancer biologist who was summarily fired by a DOGE worker she never met during Elon Musk's Valentine's Day assault on the federal workforce. This #MD08 Local Hero was doing pathbreaking research to treat pediatric cancer. https://t.co/1rviGewgVz,https://x.com/RepRaskin/status/1898167910054371387,38921,1171,2206,19,8,1,233,414,38,200,11,14,0
1897777324948640000,YYYY-00-DD 00:00:SS,"Federal workers at @HHSgov conduct critical medical research for America. I led my colleagues in demanding @SecKennedy immediately reinstate illegally purged civil servants in his agency. If Republican members can get jobs restored for their constituents, I want my constituents'",https://x.com/RepRaskin/status/1897777324948640030,34097,639,1385,10,1,3,165,225,50,302,1,0,0
1897775300416550000,YYYY-00-DD 00:00:SS,"Ahead of the 60th anniversary of Bloody Sunday, I'm joining @RepTerriSewell to reintroduce the John Lewis Voting Rights Advancement Act to protect the right of all Americans to vote without tricks &amp; laws of suppression. Let's summon the moral purpose of the great Rep. Lewis.",https://x.com/RepRaskin/status/1897775300416545002,20924,815,1451,12,0,1,211,248,39,135,0,0,0
1897756053317860000,YYYY-00-DD 00:00:SS,"Mourning the passing of Congressman Sylvester Turner, my colleague who dedicated himself to public service and the people of his beloved Houston. While he was new to Congress, his kindness and leadership leave an enduring mark on this institution. May his memory be a blessing.",https://x.com/RepRaskin/status/1897756053317861863,17797,715,987,6,0,0,52,99,22,99,0,0,0
1897369258193280000,YYYY-00-DD 00:00:SS,"Hundreds of fired civil servants at @NOAA provided seafood safety, hurricane and snowstorm forecasts and critical climate science. This week we gathered at their HQ to tell Trump and Elon Musk: we believe in facts, science and truth. Hands off NOAA! https://t.co/8DEc4Y16cV",https://x.com/RepRaskin/status/1897369258193281486,43424,3152,5161,32,8,2,536,922,111,364,23,0,0
1897134445708370000,YYYY-00-DD 00:00:SS,The felon president who pardoned 1500 violent J6 Capitol rioters he incited that went on to viciously assault American police officers just called for “law and order.”,https://x.com/RepRaskin/status/1897134445708370173,116172,5975,10269,78,13,10,1653,1475,385,759,0,0,0
1897133828239710000,YYYY-00-DD 00:00:SS,"President Trump says rates of pediatric cancer are way up, but his incompetent fanatics on DOGE fired my guest tonight, Dr. Lauren McGee, a remarkable pediatric cancer researcher who was sacked from NIH as part of Musk’s Valentine’s Day onslaught.",https://x.com/RepRaskin/status/1897133828239712337,295300,16886,26326,303,53,12,1312,5300,724,2073,2,0,0
1897105025903860000,YYYY-00-DD 00:00:SS,"Meet my guest tonight, Dr. Lauren McGee of Rockville. A life-saving biologist working to cure pediatric bone cancer, Dr. McGee was sacked by Elon Musk along with the whole probationary federal workforce. She was on “probation” because she'd been promoted for her superior work. https://t.co/JDHz4bYBNX",https://x.com/RepRaskin/status/1897105025903862152,376484,12184,21561,325,89,69,1233,4014,533,2152,50,0,0
1897104010454450000,YYYY-00-DD 00:00:SS,"Dozens of Members of the @UkraineCaucus are here to stand strong for democracy, freedom and international law against Trump, Putin and Musk. https://t.co/TF9XF5r2sI",https://x.com/RepRaskin/status/1897104010454446245,160669,10585,17742,129,26,199,2155,1746,1264,1383,51,1,0
1897089281728110000,YYYY-00-DD 00:00:SS,"I imagine they'll be translating President Trump's speech into Russian which shouldn't be hard because that was the language it was drafted in. A Moscow spokesperson states the obvious: the Trump-Vance agenda ""largely aligns"" with the Kremlin. https://t.co/cDnm6iBall",https://x.com/RepRaskin/status/1897089281728110749,14878,524,1116,10,11,3,110,173,26,221,57,0,0
1897075333121380000,YYYY-00-DD 00:00:SS,"Illegally and arbitrarily fired by Elon Musk, my constituent Dr. Lauren McGee is standing strong with me for all federal employees at the Joint Address in the Capitol tonight. Lauren's pediatric cancer research at @NIH saves lives, but DOGE throws everything into chaos.",https://x.com/RepRaskin/status/1897075333121376730,86177,3333,5162,27,7,4,552,858,97,318,0,0,0
1895886466942980000,YYYY-00-DD 00:00:SS,"Oh Donald, it must have been brutal on you and Vladimir when Paul Manafort, Michael Flynn, and Roger Stone were convicted and jailed for Russia Russia Russia. But your special relationship survived and is stronger than ever!",https://x.com/RepRaskin/status/1895886466942976243,15468,668,1137,7,1,3,150,127,41,148,0,0,0
1895886464766120000,YYYY-00-DD 00:00:SS,"“Putin went through a hell of a lot with me. He went through a phony witch hunt where they used him and Russia, Russia, Russia,” Trump said. This is touching when you think about what this couple has been through.",https://x.com/RepRaskin/status/1895886464766124425,63574,1885,3073,30,4,17,261,322,144,438,1,0,0
1895565187492820000,YYYY-00-DD 00:00:SS,They just turned the Oval Office into the Evil Office.,https://x.com/RepRaskin/status/1895565187492823317,141851,8364,13269,80,34,66,1569,1378,875,1004,3,0,0
1895259205311050000,YYYY-00-DD 00:00:SS,https://t.co/wgkxoEc6Rg,https://x.com/RepRaskin/status/1895259205311046047,11502,137,817,6,3,1,76,29,20,100,454,0,0
1895259202836430000,YYYY-00-DD 00:00:SS,"Elon Musk Fact-Checked by his own AI platform Grok! What an embarrassment this “genius” is. For my full statement and questions posed to Mr. Musk, see below. https://t.co/2NJNZv1JA7",https://x.com/RepRaskin/status/1895259202836426831,51363,1520,3526,44,15,7,449,520,108,601,40,0,0
1894818442387000000,YYYY-00-DD 00:00:SS,"Federal workers choose public service to serve our people, but the Trump administration wants to traumatize them. We need cancer researchers, forest service firefighters, nuclear safety experts, VA nurses and food safety inspectors. We don’t need Elon Musk, whatever his job is.",https://x.com/RepRaskin/status/1894818442386997520,336574,10113,24250,172,22,21,6964,2839,1095,3145,10,0,0
1894585219988020000,YYYY-00-DD 00:00:SS,"Even the people working at DOGE say it is a lawless nightmare for America. In fact, they know it better than anyone. Thanks to these true public servants who won’t stand for such a dangerous betrayal of the American people. https://t.co/OTR63Kru9F",https://x.com/RepRaskin/status/1894585219988017230,60191,4072,8260,77,9,1,1068,1284,150,628,1034,0,0
1894406672937800000,YYYY-00-DD 00:00:SS,"There's no democracy, and therefore no progress, without freedom of thought and conscience. The world can celebrate the release of Nigerian prisoner of conscience Mubarak Bala, whose freedom I have been demanding with colleagues in @TLHumanRights. https://t.co/9nq49azH8v",https://x.com/RepRaskin/status/1894406672937803916,22222,546,1137,5,0,1,167,126,43,188,3,0,0
1894218392418000000,YYYY-00-DD 00:00:SS,Honored to join Ike and Catherine Leggett and hundreds of MoCo constituents and community leaders for the jubilant naming ceremony for the Ike Leggett Building in Rockville. Generations to come will honor his service. https://t.co/QnwLsGCLIK,https://x.com/RepRaskin/status/1894218392418005424,19641,242,638,4,4,0,77,40,27,132,12,0,0
1893118725563280000,YYYY-00-DD 00:00:SS,"MaryBeth Hastings has devoted her career to human rights, one of the many people in #MD08 who have seen their lives, livelihood and work upended by the attacks on USAID. Thanks MaryBeth for reminding us: foreign aid is critical for democratic solidarity. https://t.co/6pbwmynxgG",https://x.com/RepRaskin/status/1893118725563281492,43529,482,1264,12,2,8,248,106,57,202,147,9,0
1892682938493420000,YYYY-00-DD 00:00:SS,"President Trump calls Zelensky a “dictator,” which can’t be true because Trump loves all the dictators. That’s why he appeases &amp; coddles Putin &amp; his filthy imperialist war on the people of Ukraine. History teaches us that we bow down to dictators &amp; tyrants at our own peril.",https://x.com/RepRaskin/status/1892682938493419839,44229,2247,4316,31,9,8,876,498,198,483,2,0,0
1892675525912520000,YYYY-00-DD 00:00:SS,"Elon Musk fired thousands of IRS workers in tax season, hundreds of VA health researchers and countless other civil servants doing their jobs. This rampage throws the lives of civil servants into chaos and makes life harder for every American.",https://x.com/RepRaskin/status/1892675525912518783,254174,1820,7671,53,11,11,1784,657,366,3008,2,0,0
1892659549380780000,YYYY-00-DD 00:00:SS,"I'd like to bring this multimillion-dollar photo-op to the attention of Elon Musk and DOGE. Instead of firing food inspectors and air traffic controllers and cancelling critical medical research at NIH, stop this outrageous waste of our people's tax dollars!",https://x.com/RepRaskin/status/1892659549380780174,151337,4778,8952,116,28,5,1521,1356,263,1023,3,0,0
1892267708734950000,YYYY-00-DD 00:00:SS,"Now is the time for our citizenry to fight for our federal workers and national programs. Let’s stand up to the power-mad autocrats, plutocrats and theocrats attacking democracy—at home and abroad. I spoke with @briantylercohen about our historic assignment today. https://t.co/MiFcR8X0Ag",https://x.com/RepRaskin/status/1892267708734951777,68187,2587,6219,55,11,8,1497,817,161,793,12,0,0
1892231029311600000,YYYY-00-DD 00:00:SS,"We've gathered in solidarity wherever federal workers, federal programs and our Constitution are under attack. The majority will defend representative democracy against the cyberbarons. https://t.co/EAapdlleOy",https://x.com/RepRaskin/status/1892231029311603003,40801,1604,3655,17,1,2,795,398,82,452,12,0,0
1892217272413900000,YYYY-00-DD 00:00:SS,"If you want to conduct an audit, call auditors and forensic accountants. If you want to seize private data from the people and conduct a political hatchet job, call Elon Musk and his night crew of juvenile computer hackers. https://t.co/pL015x4GyM",https://x.com/RepRaskin/status/1892217272413900801,695558,17605,45936,453,136,58,11651,5979,1295,6138,73,0,0
1892028458621900000,YYYY-00-DD 00:00:SS,"Indiscriminate mass layoffs by Elon Musk are ravaging key programs, depriving our people of nuclear safety inspectors, air traffic controllers and food safety inspectors. These cuts crush democracy and devastate the livelihood of tens of thousands of public servants.",https://x.com/RepRaskin/status/1892028458621898893,295288,6341,17761,132,27,25,5807,1953,912,2691,3,0,0
1891311223662160000,YYYY-00-DD 00:00:SS,"Trump and Musk are dismantling the government’s capacity to spot, publicize and reject interference in our elections by Russian and other autocratic agents. The states and the people must start planning now to pick up the slack. https://t.co/SRhNRjrTI3",https://x.com/RepRaskin/status/1891311223662161986,24819,572,1704,22,14,1,298,237,63,358,164,0,0
1890795892703130000,YYYY-00-DD 00:00:SS,"After Vance demands firing of a WSJ reporter who covered the racist posts of a Musk aide, and Trump threatens to pull broadcast licenses of news outlets he can’t control, Vance lectures Europe about free speech—to mask his dangerous embrace of the extreme Right in Germany.",https://x.com/RepRaskin/status/1890795892703129788,1296697,37613,59810,1105,177,73,3813,9674,2859,5748,10,0,0
1890446940799650000,YYYY-00-DD 00:00:SS,To AG Bondi—Halt now the threatened firing of the excellent lawyers in the Public Integrity Section. You have no right to fire public servants defending public integrity in order to override the decisions of US Attorney Sassoon and a Grand Jury to prosecute a politician for,https://x.com/RepRaskin/status/1890446940799651919,700116,14211,43689,375,69,55,9156,4242,3293,12513,45,0,0
1890211375567500000,YYYY-00-DD 00:00:SS,"Today, I took to the House Floor to make an urgent PSA about constitutional crimes taking place in the nation’s capital. There’s a serial constitutional violator at large in DC, spreading corruption and authoritarianism with his juvenile night crew: Elon Musk. https://t.co/3kq7iCwjD2",https://x.com/RepRaskin/status/1890211375567499522,550228,15936,37022,449,106,33,7025,5289,1027,4677,96,0,0
